{
  "$schema": "http://json-schema.org/draft-07/schema#",
  "type": "object",
  "properties": {
    "limits": {
      "type": "object",
      "properties": {
        "timeout_ms": {
          "type": "integer",
          "minimum": 1,
          "maximum": 2147483647
        },
        "max_model_requests": {
          "type": "integer",
          "minimum": 0
        },
        "max_invocations": {
          "type": "integer",
          "minimum": 1,
          "maximum": 2147483647
        },
        "max_tool_calls": {
          "type": "integer",
          "minimum": 0
        },
        "max_output_bytes": {
          "type": "integer",
          "minimum": 1,
          "maximum": 2147483647
        },
        "max_request_bytes": {
          "type": "integer",
          "minimum": 1,
          "maximum": 2147483647
        },
        "max_concurrency": {
          "type": "integer",
          "minimum": 1,
          "maximum": 2147483647
        },
        "effect_wait_ms": {
          "type": "integer",
          "minimum": 0
        }
      },
      "required": [],
      "additionalProperties": false
    },
    "step_defaults": {
      "type": "object",
      "properties": {
        "timeout_ms": {
          "type": "integer",
          "minimum": 1,
          "maximum": 2147483647
        },
        "max_agent_turns": {
          "type": "integer",
          "minimum": 1,
          "maximum": 2147483647
        },
        "max_model_requests": {
          "type": "integer",
          "minimum": 1,
          "maximum": 2147483647
        }
      },
      "required": [],
      "additionalProperties": false
    },
    "allow_local_processes": {
      "type": "boolean"
    },
    "web": {
      "type": "boolean"
    },
    "classification": {
      "type": "object",
      "properties": {
        "provider": {
          "const": "typesafe"
        },
        "model": {
          "type": "string",
          "minLength": 1
        },
        "api_key_env": {
          "type": "string",
          "pattern": "^[A-Z_][A-Z0-9_]*$"
        }
      },
      "required": [
        "provider",
        "model"
      ],
      "additionalProperties": false
    },
    "runtimes": {
      "type": "object",
      "propertyNames": {
        "type": "string",
        "pattern": "^[a-z][a-z0-9_]*$",
        "not": {
          "enum": [
            "constructor",
            "prototype",
            "__proto__"
          ]
        }
      },
      "additionalProperties": {
        "type": "object",
        "properties": {
          "command": {
            "type": "string",
            "minLength": 1
          },
          "args": {
            "type": "array",
            "items": {
              "type": "string"
            }
          },
          "version": {
            "type": "string",
            "minLength": 1
          }
        },
        "required": [
          "command",
          "version"
        ],
        "additionalProperties": false
      }
    },
    "models": {
      "type": "object",
      "propertyNames": {
        "anyOf": [
          {
            "type": "string",
            "pattern": "^[a-z][a-z0-9_]*$",
            "not": {
              "enum": [
                "constructor",
                "prototype",
                "__proto__"
              ]
            }
          },
          {
            "type": "string",
            "pattern": "^[a-z0-9-]+/[A-Za-z0-9._:-]+$",
            "maxLength": 200
          }
        ]
      },
      "additionalProperties": {
        "oneOf": [
          {
            "type": "object",
            "properties": {
              "backend": {
                "const": "openai-responses"
              },
              "model": {
                "type": "string",
                "minLength": 1
              },
              "api_key_env": {
                "type": "string",
                "pattern": "^[A-Z_][A-Z0-9_]*$"
              },
              "max_output_tokens": {
                "type": "integer",
                "minimum": 1,
                "maximum": 2147483647
              },
              "reasoning_effort": {
                "enum": [
                  "none",
                  "minimal",
                  "low",
                  "medium",
                  "high",
                  "xhigh"
                ]
              }
            },
            "required": [
              "backend",
              "model",
              "api_key_env",
              "max_output_tokens"
            ],
            "additionalProperties": false
          },
          {
            "type": "object",
            "properties": {
              "backend": {
                "const": "anthropic-messages"
              },
              "model": {
                "type": "string",
                "minLength": 1
              },
              "api_key_env": {
                "type": "string",
                "pattern": "^[A-Z_][A-Z0-9_]*$"
              },
              "max_output_tokens": {
                "type": "integer",
                "minimum": 1,
                "maximum": 2147483647
              },
              "effort": {
                "enum": [
                  "low",
                  "medium",
                  "high",
                  "xhigh",
                  "max"
                ]
              }
            },
            "required": [
              "backend",
              "model",
              "api_key_env",
              "max_output_tokens"
            ],
            "additionalProperties": false
          },
          {
            "type": "object",
            "properties": {
              "backend": {
                "const": "openrouter-chat"
              },
              "model": {
                "type": "string",
                "minLength": 1
              },
              "api_key_env": {
                "type": "string",
                "pattern": "^[A-Z_][A-Z0-9_]*$"
              },
              "max_output_tokens": {
                "type": "integer",
                "minimum": 1,
                "maximum": 2147483647
              },
              "reasoning_effort": {
                "enum": [
                  "minimal",
                  "low",
                  "medium",
                  "high"
                ]
              }
            },
            "required": [
              "backend",
              "model",
              "api_key_env",
              "max_output_tokens"
            ],
            "additionalProperties": false
          },
          {
            "type": "object",
            "properties": {
              "backend": {
                "enum": [
                  "codex",
                  "claude"
                ]
              },
              "command": {
                "type": "string",
                "minLength": 1
              },
              "model": {
                "type": "string",
                "minLength": 1
              },
              "reasoning_effort": {
                "type": "string",
                "minLength": 1
              }
            },
            "required": [
              "backend"
            ],
            "additionalProperties": false
          },
          {
            "type": "object",
            "properties": {
              "backend": {
                "const": "method"
              },
              "model": {
                "type": "string",
                "minLength": 1
              },
              "max_output_tokens": {
                "type": "integer",
                "minimum": 1,
                "maximum": 2147483647
              },
              "reasoning_effort": {
                "enum": [
                  "minimal",
                  "low",
                  "medium",
                  "high"
                ]
              }
            },
            "required": [
              "backend",
              "model"
            ],
            "additionalProperties": false
          }
        ]
      }
    },
    "tools": {
      "type": "object",
      "propertyNames": {
        "type": "string",
        "pattern": "^[a-z][a-z0-9_]*$",
        "not": {
          "enum": [
            "constructor",
            "prototype",
            "__proto__"
          ]
        }
      },
      "additionalProperties": {
        "oneOf": [
          {
            "type": "object",
            "properties": {
              "description": {
                "type": "string",
                "minLength": 1
              },
              "in": {
                "type": "object",
                "propertyNames": {
                  "type": "string",
                  "pattern": "^[a-z][a-z0-9_]*$",
                  "not": {
                    "enum": [
                      "constructor",
                      "prototype",
                      "__proto__"
                    ]
                  }
                },
                "additionalProperties": {
                  "$ref": "https://github.com/method-ai-hq/method-spec/raw/main/spec/method-3.schema.json#/$defs/data"
                }
              },
              "out": {
                "type": "object",
                "propertyNames": {
                  "type": "string",
                  "pattern": "^[a-z][a-z0-9_]*$",
                  "not": {
                    "enum": [
                      "constructor",
                      "prototype",
                      "__proto__"
                    ]
                  }
                },
                "additionalProperties": {
                  "$ref": "https://github.com/method-ai-hq/method-spec/raw/main/spec/method-3.schema.json#/$defs/data"
                }
              },
              "run": {
                "type": "object",
                "properties": {
                  "kind": {
                    "const": "run"
                  },
                  "runtime": {
                    "type": "string",
                    "pattern": "^[a-z][a-z0-9_]*$",
                    "not": {
                      "enum": [
                        "constructor",
                        "prototype",
                        "__proto__"
                      ]
                    }
                  },
                  "entrypoint": {
                    "type": "string",
                    "minLength": 1
                  },
                  "args": {
                    "type": "array",
                    "items": {
                      "type": "string"
                    }
                  }
                },
                "required": [
                  "kind",
                  "runtime",
                  "entrypoint"
                ],
                "additionalProperties": false
              },
              "effects": {
                "type": "array",
                "items": {
                  "type": "string",
                  "pattern": "^[a-z][a-z0-9_]*$",
                  "not": {
                    "enum": [
                      "constructor",
                      "prototype",
                      "__proto__"
                    ]
                  }
                },
                "uniqueItems": true
              }
            },
            "required": [
              "description",
              "in",
              "out",
              "run",
              "effects"
            ],
            "additionalProperties": false
          },
          {
            "type": "object",
            "properties": {
              "description": {
                "type": "string",
                "minLength": 1
              },
              "connection": {
                "type": "string",
                "pattern": "^[a-z][a-z0-9_]*$",
                "not": {
                  "enum": [
                    "constructor",
                    "prototype",
                    "__proto__"
                  ]
                }
              },
              "tool": {
                "type": "string",
                "minLength": 1
              },
              "parameters": {
                "type": "object"
              },
              "effects": {
                "type": "array",
                "items": {
                  "type": "string",
                  "pattern": "^[a-z][a-z0-9_]*$",
                  "not": {
                    "enum": [
                      "constructor",
                      "prototype",
                      "__proto__"
                    ]
                  }
                },
                "uniqueItems": true
              }
            },
            "required": [
              "description",
              "connection",
              "tool",
              "parameters",
              "effects"
            ],
            "additionalProperties": false
          }
        ]
      }
    },
    "environment": {
      "type": "object",
      "propertyNames": {
        "type": "string",
        "pattern": "^[a-z][a-z0-9_]*$",
        "not": {
          "enum": [
            "constructor",
            "prototype",
            "__proto__"
          ]
        }
      },
      "additionalProperties": {
        "type": "string"
      }
    },
    "rubric": {
      "type": "object",
      "properties": {
        "judge_runs": {
          "type": "integer",
          "minimum": 1,
          "maximum": 9
        },
        "classify_threshold": {
          "type": "number",
          "minimum": 0.5,
          "maximum": 1
        },
        "max_value_bytes": {
          "type": "integer",
          "minimum": 1,
          "maximum": 2147483647
        }
      },
      "required": [],
      "additionalProperties": false
    }
  },
  "required": [],
  "additionalProperties": false
}
